{
  "schema_version": "1",
  "inspected_head_sha": "a7995baf187e0e96c3f8152212060cedfc7fd921",
  "inspected_base_sha": "98c2dc68ff3bf6520bb7c3986140749d288d299f",
  "pr_url": "none",
  "scope": "Quick task 261022-l7h; full requested commit diff, tests, planning artifacts, and relevant rendering/data-production code.",
  "verdict": "no-findings",
  "summary": "No actionable defects found. Verification remains incomplete: pytest was blocked before collection by the read-only sandbox. In-memory checks passed all 10 added tests' template assertions at HEAD; seven failed against the base template as expected. An additional 96 generated-cycle combinations passed.",
  "coverage": [
    "Reviewed all nine changed files, recovering truncated output through targeted reads.",
    "Traced CycleTally.to_record → cycle_view → _build_app_context → partial_app_card → app_card.html → cycle_grade.html.",
    "Checked singular/plural wording, record versus row counts, legacy aggregate records, mixed failures/skips, unevaluated queues, eligible-but-unsearched work, and fetch failures.",
    "Executed added test assertions against the actual cycle_view and Jinja template in memory: HEAD 10 passed; base 3 passed and 7 failed. This bypassed HTTP routing and fixtures.",
    "Executed 96 CycleTally-generated combinations covering accepted/failed commands, both malformed queues, unevaluated queues, fetch errors, long reasons, and HTML escaping.",
    "Reviewed refresh behavior and configuration/stale-state implications: classification uses each rendered cycle snapshot and introduces no shared mutable state.",
    "Checked security and policy changes: autoescaping remains intact; no CI, acceptance, publication, or enforcement configuration changed.",
    "Reviewed test weaknesses: color assertions search the entire card and may match unrelated elements; no dedicated added route test combines fetch failure with skips. The template matrix covers that combination, but does not replace a regression test."
  ],
  "exclusions": [
    "Live browser/htmx interaction and external Arr services.",
    "Full repository test suite and lint execution.",
    "Hypothetical future wording changes and manually inconsistent persisted counters were not treated as demonstrated production defects."
  ],
  "commands_run": [
    {
      "command": "git rev-parse HEAD",
      "exit_code": 0,
      "purpose": "Confirm inspected head."
    },
    {
      "command": "git cat-file -e 98c2dc68ff3bf6520bb7c3986140749d288d299f",
      "exit_code": 0,
      "purpose": "Confirm base exists."
    },
    {
      "command": "cat /Users/julianamacbook/.agents/skills/review/SKILL.md",
      "exit_code": 0,
      "purpose": "Read review workflow."
    },
    {
      "command": "git diff 98c2dc68ff3bf6520bb7c3986140749d288d299f..a7995baf187e0e96c3f8152212060cedfc7fd921",
      "exit_code": 0,
      "purpose": "Read full diff; output truncated, followed by targeted reads."
    },
    {
      "command": "pwd; git diff --stat 98c2dc68ff3bf6520bb7c3986140749d288d299f..a7995baf187e0e96c3f8152212060cedfc7fd921; git status --short; cat triggarr/templates/partials/cycle_grade.html; cat triggarr/search/outcome.py",
      "exit_code": 0,
      "purpose": "Confirm workspace, scope, clean status, template, and complete outcome implementation."
    },
    {
      "command": "cat tests/test_app_cards.py",
      "exit_code": 0,
      "purpose": "Read card tests; subsequently recovered truncated sections."
    },
    {
      "command": "git diff 98c2dc68ff3bf6520bb7c3986140749d288d299f..a7995baf187e0e96c3f8152212060cedfc7fd921 -- .planning/quick",
      "exit_code": 0,
      "purpose": "Review intent and review/verification artifacts; subsequently recovered truncated sections."
    },
    {
      "command": "sed -n '1,360p' tests/test_app_cards.py",
      "exit_code": 0,
      "purpose": "Read fixtures and initial tests."
    },
    {
      "command": "sed -n '740,1100p' tests/test_app_cards.py",
      "exit_code": 0,
      "purpose": "Read existing outcome, upgrade, escaping, and refresh tests."
    },
    {
      "command": "rg -n 'cycle_view|partial_app_card|last_cycle|data-cycle-detail' triggarr/web/routes.py triggarr/templates/partials/app_card.html triggarr/state.py; cat pyproject.toml; ls -d .venv /Users/julianamacbook/triggarr/.venv 2>/dev/null",
      "exit_code": 1,
      "purpose": "Locate callers, inspect dependencies, and find interpreter. Local .venv absent; external environment found."
    },
    {
      "command": "sed -n '360,545p' tests/test_app_cards.py; sed -n '1100,1450p' tests/test_app_cards.py; sed -n '365,410p' triggarr/web/routes.py; sed -n '1200,1245p' triggarr/web/routes.py; cat triggarr/templates/partials/app_card.html",
      "exit_code": 0,
      "purpose": "Read remaining tests and rendering callers; recover truncated caller output separately."
    },
    {
      "command": "cat .planning/quick/261022-l7h-fix-card-reasons-label-for-skip-only-row/261022-l7h-RESEARCH.md .planning/quick/261022-l7h-fix-card-reasons-label-for-skip-only-row/261022-l7h-REVIEW.md",
      "exit_code": 0,
      "purpose": "Read rationale and prior claims as source material, not correctness evidence."
    },
    {
      "command": "PYTHONDONTWRITEBYTECODE=1 /Users/julianamacbook/triggarr/.venv/bin/python -m pytest tests/test_app_cards.py -q -p no:cacheprovider",
      "exit_code": 1,
      "purpose": "Attempt card suite; blocked before collection because no writable temporary directory exists."
    },
    {
      "command": "sed -n '365,410p' triggarr/web/routes.py; sed -n '1200,1245p' triggarr/web/routes.py; cat triggarr/templates/partials/app_card.html; sed -n '1310,1450p' tests/test_app_cards.py",
      "exit_code": 0,
      "purpose": "Recover complete caller/template and final test sections."
    },
    {
      "command": "cat .planning/quick/261022-l7h-fix-card-reasons-label-for-skip-only-row/261022-l7h-PLAN.md .planning/quick/261022-l7h-fix-card-reasons-label-for-skip-only-row/261022-l7h-SUMMARY.md",
      "exit_code": 0,
      "purpose": "Read complete plan and implementation claims."
    },
    {
      "command": "PYTHONDONTWRITEBYTECODE=1 /Users/julianamacbook/triggarr/.venv/bin/python - <<'PY' [in-memory AST/template assertion harness] PY",
      "exit_code": 1,
      "purpose": "Attempt in-memory assertion harness; shell rejected heredoc temporary-file creation before Python executed."
    },
    {
      "command": "cat .planning/quick/261022-l7h-fix-card-reasons-label-for-skip-only-row/261022-l7h-VERIFICATION.md; git diff 98c2dc68ff3bf6520bb7c3986140749d288d299f..a7995baf187e0e96c3f8152212060cedfc7fd921 -- .planning/STATE.md",
      "exit_code": 0,
      "purpose": "Read verification claims and state changes."
    },
    {
      "command": "PYTHONDONTWRITEBYTECODE=1 /Users/julianamacbook/triggarr/.venv/bin/python -c '<in-memory harness: AST-extract _last_cycle_record and functions at lines 550–738; execute each with a client adapter rendering cycle_view through the actual Jinja template; compare HEAD and base>'",
      "exit_code": 0,
      "purpose": "HEAD: 10 assertions suites passed. Base: 3 passed, 7 failed, as expected."
    },
    {
      "command": "git show 98c2dc68ff3bf6520bb7c3986140749d288d299f:triggarr/templates/partials/cycle_grade.html",
      "exit_code": 0,
      "purpose": "Subprocess inside the successful harness to obtain the base template."
    },
    {
      "command": "sed -n '1,30p' .planning/quick/261022-l7h-fix-card-reasons-label-for-skip-only-row/261022-l7h-RESEARCH.md; sed -n '1,30p' .planning/quick/261022-l7h-fix-card-reasons-label-for-skip-only-row/261022-l7h-REVIEW.md; git status --short",
      "exit_code": 0,
      "purpose": "Recover document openings and confirm unchanged working tree."
    },
    {
      "command": "PYTHONDONTWRITEBYTECODE=1 /Users/julianamacbook/triggarr/.venv/bin/python -c '<in-memory matrix: product([0,1],[0,1],[0,1,3],[0,2],[False,True],[False,True]); generate CycleTally records, render cycle_view through HEAD template, assert expected label category and escaped script text>'",
      "exit_code": 0,
      "purpose": "Verify 96 generated-cycle combinations."
    }
  ],
  "findings": [],
  "limitations": [
    "This is an incomplete verification result, not a clean test-suite approval: the requested checkout was inspected, but route-level pytest execution could not start.",
    "Inline Python commands are summarized in the command ledger; their full source appears in the tool-call transcript.",
    "In-memory assertion execution substituted the HTTP client and date filters; it does not validate routing, database fixtures, or browser behavior.",
    "Existing reports' claims of 84 card tests and 2215 total tests passing were not independently reproduced or accepted as evidence.",
    "No files were edited, committed, pushed, or published."
  ]
}